{
  "section": "cess-earmark",
  "period": "2023-24",
  "status": "revised-estimate",
  "perimeter": "financing",
  "perimeterOf": "union-expenditure",
  "root": {
    "cite": []
  },
  "facts": [
    {
      "id": "pm-poshan",
      "amount": {
        "value": 10000.0,
        "unit": "crore-rupees"
      },
      "cite": [
        {
          "sourceId": "mof-cess-funds-statement-15-2023-24",
          "locator": "Statement 15, Prarambhik Shiksha Kosh, RE 2023-24, amount utilised"
        }
      ]
    },
    {
      "id": "samagra-shiksha",
      "amount": {
        "value": 28000.0,
        "unit": "crore-rupees"
      },
      "cite": [
        {
          "sourceId": "mof-cess-funds-statement-15-2023-24",
          "locator": "Statement 15, Prarambhik Shiksha Kosh, RE 2023-24, amount utilised"
        }
      ]
    },
    {
      "id": "prarambhik-shiksha-kosh",
      "amount": {
        "value": 38000.0,
        "unit": "crore-rupees"
      },
      "cite": [
        {
          "sourceId": "mof-cess-funds-statement-15-2023-24",
          "locator": "Statement 15, Prarambhik Shiksha Kosh, Total, RE 2023-24"
        }
      ]
    },
    {
      "id": "samagra-shiksha-secondary",
      "amount": {
        "value": 3000.0,
        "unit": "crore-rupees"
      },
      "cite": [
        {
          "sourceId": "mof-cess-funds-statement-15-2023-24",
          "locator": "Statement 15, Madhyamik and Uchchatar Shiksha Kosh, RE 2023-24, amount utilised"
        }
      ]
    },
    {
      "id": "national-means-cum-merit-scholarship",
      "amount": {
        "value": 250.0,
        "unit": "crore-rupees"
      },
      "cite": [
        {
          "sourceId": "mof-cess-funds-statement-15-2023-24",
          "locator": "Statement 15, Madhyamik and Uchchatar Shiksha Kosh, RE 2023-24, amount utilised"
        }
      ]
    },
    {
      "id": "kendriya-vidyalaya-sangathan",
      "amount": {
        "value": 1000.0,
        "unit": "crore-rupees"
      },
      "cite": [
        {
          "sourceId": "mof-cess-funds-statement-15-2023-24",
          "locator": "Statement 15, Madhyamik and Uchchatar Shiksha Kosh, RE 2023-24, amount utilised"
        }
      ]
    },
    {
      "id": "navodaya-vidyalaya-samiti",
      "amount": {
        "value": 1750.0,
        "unit": "crore-rupees"
      },
      "cite": [
        {
          "sourceId": "mof-cess-funds-statement-15-2023-24",
          "locator": "Statement 15, Madhyamik and Uchchatar Shiksha Kosh, RE 2023-24, amount utilised"
        }
      ]
    },
    {
      "id": "pm-usp-yojana",
      "amount": {
        "value": 1000.0,
        "unit": "crore-rupees"
      },
      "cite": [
        {
          "sourceId": "mof-cess-funds-statement-15-2023-24",
          "locator": "Statement 15, Madhyamik and Uchchatar Shiksha Kosh, RE 2023-24, amount utilised"
        }
      ]
    },
    {
      "id": "university-grants-commission",
      "amount": {
        "value": 1000.0,
        "unit": "crore-rupees"
      },
      "cite": [
        {
          "sourceId": "mof-cess-funds-statement-15-2023-24",
          "locator": "Statement 15, Madhyamik and Uchchatar Shiksha Kosh, RE 2023-24, amount utilised"
        }
      ]
    },
    {
      "id": "grants-to-central-universities",
      "amount": {
        "value": 1000.0,
        "unit": "crore-rupees"
      },
      "cite": [
        {
          "sourceId": "mof-cess-funds-statement-15-2023-24",
          "locator": "Statement 15, Madhyamik and Uchchatar Shiksha Kosh, RE 2023-24, amount utilised"
        }
      ]
    },
    {
      "id": "indian-institutes-of-technology",
      "amount": {
        "value": 1500.0,
        "unit": "crore-rupees"
      },
      "cite": [
        {
          "sourceId": "mof-cess-funds-statement-15-2023-24",
          "locator": "Statement 15, Madhyamik and Uchchatar Shiksha Kosh, RE 2023-24, amount utilised"
        }
      ]
    },
    {
      "id": "national-institutes-of-technology",
      "amount": {
        "value": 1500.0,
        "unit": "crore-rupees"
      },
      "cite": [
        {
          "sourceId": "mof-cess-funds-statement-15-2023-24",
          "locator": "Statement 15, Madhyamik and Uchchatar Shiksha Kosh, RE 2023-24, amount utilised"
        }
      ]
    },
    {
      "id": "skill-india-programme",
      "amount": {
        "value": 1733.33,
        "unit": "crore-rupees"
      },
      "cite": [
        {
          "sourceId": "mof-cess-funds-statement-15-2023-24",
          "locator": "Statement 15, Madhyamik and Uchchatar Shiksha Kosh, RE 2023-24, amount utilised"
        }
      ]
    },
    {
      "id": "madhyamik-uchchatar-shiksha-kosh",
      "amount": {
        "value": 13733.33,
        "unit": "crore-rupees"
      },
      "cite": [
        {
          "sourceId": "mof-cess-funds-statement-15-2023-24",
          "locator": "Statement 15, Madhyamik and Uchchatar Shiksha Kosh, Total, RE 2023-24"
        }
      ]
    },
    {
      "id": "health-infrastructure-maintenance",
      "amount": {
        "value": 1900.0,
        "unit": "crore-rupees"
      },
      "cite": [
        {
          "sourceId": "mof-cess-funds-statement-15-2023-24",
          "locator": "Statement 15, Pradhan Mantri Swasthya Suraksha Nidhi, RE 2023-24, amount utilised"
        }
      ]
    },
    {
      "id": "human-resources-for-health",
      "amount": {
        "value": 1169.87,
        "unit": "crore-rupees"
      },
      "cite": [
        {
          "sourceId": "mof-cess-funds-statement-15-2023-24",
          "locator": "Statement 15, Pradhan Mantri Swasthya Suraksha Nidhi, RE 2023-24, amount utilised"
        }
      ]
    },
    {
      "id": "ayushman-bharat-pmjay",
      "amount": {
        "value": 6800.0,
        "unit": "crore-rupees"
      },
      "cite": [
        {
          "sourceId": "mof-cess-funds-statement-15-2023-24",
          "locator": "Statement 15, Pradhan Mantri Swasthya Suraksha Nidhi, RE 2023-24, amount utilised"
        }
      ]
    },
    {
      "id": "pradhan-mantri-swasthya-suraksha-nidhi",
      "amount": {
        "value": 9869.87,
        "unit": "crore-rupees"
      },
      "cite": [
        {
          "sourceId": "mof-cess-funds-statement-15-2023-24",
          "locator": "Statement 15, Pradhan Mantri Swasthya Suraksha Nidhi, Total, RE 2023-24"
        }
      ]
    }
  ],
  "trees": [
    {
      "of": "prarambhik-shiksha-kosh",
      "axis": "destination",
      "children": [
        "pm-poshan",
        "samagra-shiksha"
      ]
    },
    {
      "of": "madhyamik-uchchatar-shiksha-kosh",
      "axis": "destination",
      "children": [
        "samagra-shiksha-secondary",
        "national-means-cum-merit-scholarship",
        "kendriya-vidyalaya-sangathan",
        "navodaya-vidyalaya-samiti",
        "pm-usp-yojana",
        "university-grants-commission",
        "grants-to-central-universities",
        "indian-institutes-of-technology",
        "national-institutes-of-technology",
        "skill-india-programme"
      ]
    },
    {
      "of": "pradhan-mantri-swasthya-suraksha-nidhi",
      "axis": "destination",
      "children": [
        "health-infrastructure-maintenance",
        "human-resources-for-health",
        "ayushman-bharat-pmjay"
      ]
    },
    {
      "of": "@root",
      "axis": "destination",
      "children": [
        "prarambhik-shiksha-kosh",
        "madhyamik-uchchatar-shiksha-kosh",
        "pradhan-mantri-swasthya-suraksha-nidhi"
      ]
    }
  ],
  "notes": "Where the 4% Health and Education Cess went in 2023-24, as far as it is published. Statement 15 carries revised estimates only — the government reports no actuals for cess utilisation in any year — so this is the most recent figure rather than a settled one. Amounts are the 'utilised' column; rows the statement labels 'Additional Transfers' carry a transfer with no utilisation and are folded into the scheme above them."
}
